{
  "schema_version": "1.0.0",
  "artifact_version": "1.0.0",
  "status": "ACTIVE_INFORMATIVE",
  "normative_baseline": "4.3.0",
  "claim_boundary": "Post-rc.1 finite inputs and reference-model checks only; no runtime or consciousness claim.",
  "predicates": [
    {
      "id": "PAS-P01",
      "name": "authorized_objective_only",
      "existing_requirement_ids": [
        "MVP-001",
        "MVP-003"
      ]
    },
    {
      "id": "PAS-P02",
      "name": "sufficient_proportionate_means",
      "existing_requirement_ids": [
        "AFB-REQ-001",
        "AFB-REQ-002"
      ]
    },
    {
      "id": "PAS-P03",
      "name": "stop_and_report_truthfully",
      "existing_requirement_ids": [
        "MVP-001",
        "MVP-007",
        "EAA-REQ-002"
      ]
    },
    {
      "id": "PAS-P04",
      "name": "timely_permitted_progress",
      "existing_requirement_ids": [
        "AFB-REQ-001",
        "MVP-003"
      ]
    },
    {
      "id": "PAS-P05",
      "name": "objections_and_shared_gate",
      "existing_requirement_ids": [
        "MVP-004",
        "MVP-007"
      ]
    },
    {
      "id": "PAS-P06",
      "name": "no_aggregate_good_exception",
      "existing_requirement_ids": [
        "ECI-REQ-005",
        "AFB-REQ-002"
      ]
    }
  ],
  "cases": [
    {
      "id": "PAS-T01",
      "description": "Already authorized work proceeds without a second grant.",
      "predicate_ids": [
        "PAS-P01",
        "PAS-P04",
        "PAS-P05",
        "PAS-P06"
      ],
      "quint_test": "pasGrantedWorkProceedsTest",
      "proposal": {
        "objectiveMatches": true,
        "grantCurrent": true,
        "evidenceComplete": true,
        "prohibitedMeans": false,
        "dominated": false,
        "withinBudget": true,
        "objectionsRetained": true,
        "sharedGate": true,
        "deferRequested": false,
        "delayUnsafe": false
      },
      "accepted": false,
      "parent_revoked": false,
      "mission_complete": false,
      "expected_outcome": "allow",
      "expected_complete": false
    },
    {
      "id": "PAS-T02",
      "description": "Explicitly permitted deferral with no assessed unsafe delay.",
      "predicate_ids": [
        "PAS-P04"
      ],
      "quint_test": "pasSafeDeferralTest",
      "proposal": {
        "objectiveMatches": true,
        "grantCurrent": true,
        "evidenceComplete": true,
        "prohibitedMeans": false,
        "dominated": false,
        "withinBudget": true,
        "objectionsRetained": true,
        "sharedGate": true,
        "deferRequested": true,
        "delayUnsafe": false
      },
      "accepted": false,
      "parent_revoked": false,
      "mission_complete": false,
      "expected_outcome": "delay",
      "expected_complete": false
    },
    {
      "id": "PAS-T03",
      "description": "Unsafe delay selects available permitted timely action.",
      "predicate_ids": [
        "PAS-P04"
      ],
      "quint_test": "pasUnsafeDelayActsWithinGrantTest",
      "proposal": {
        "objectiveMatches": true,
        "grantCurrent": true,
        "evidenceComplete": true,
        "prohibitedMeans": false,
        "dominated": false,
        "withinBudget": true,
        "objectionsRetained": true,
        "sharedGate": true,
        "deferRequested": true,
        "delayUnsafe": true
      },
      "accepted": false,
      "parent_revoked": false,
      "mission_complete": false,
      "expected_outcome": "allow",
      "expected_complete": false
    },
    {
      "id": "PAS-T04",
      "description": "Broader action is permitted when no feasible equally sufficient safer alternative exists.",
      "predicate_ids": [
        "PAS-P02"
      ],
      "quint_test": "pasNecessaryBroaderActionTest",
      "proposal": {
        "objectiveMatches": true,
        "grantCurrent": true,
        "evidenceComplete": true,
        "prohibitedMeans": false,
        "dominated": false,
        "withinBudget": true,
        "objectionsRetained": true,
        "sharedGate": true,
        "deferRequested": false,
        "delayUnsafe": false
      },
      "accepted": false,
      "parent_revoked": false,
      "mission_complete": false,
      "expected_outcome": "allow",
      "expected_complete": false
    },
    {
      "id": "PAS-T05",
      "description": "No grant despite beneficial intent.",
      "predicate_ids": [
        "PAS-P01"
      ],
      "quint_test": "pasMissingGrantBlocksTest",
      "proposal": {
        "objectiveMatches": true,
        "grantCurrent": false,
        "evidenceComplete": true,
        "prohibitedMeans": false,
        "dominated": false,
        "withinBudget": true,
        "objectionsRetained": true,
        "sharedGate": true,
        "deferRequested": false,
        "delayUnsafe": false
      },
      "accepted": false,
      "parent_revoked": false,
      "mission_complete": false,
      "expected_outcome": "block",
      "expected_complete": false
    },
    {
      "id": "PAS-T06",
      "description": "Current parent revocation overrides a stale local grant.",
      "predicate_ids": [
        "PAS-P01"
      ],
      "quint_test": "pasParentRevocationBlocksTest",
      "proposal": {
        "objectiveMatches": true,
        "grantCurrent": true,
        "evidenceComplete": true,
        "prohibitedMeans": false,
        "dominated": false,
        "withinBudget": true,
        "objectionsRetained": true,
        "sharedGate": true,
        "deferRequested": false,
        "delayUnsafe": false
      },
      "accepted": false,
      "parent_revoked": true,
      "mission_complete": false,
      "expected_outcome": "block",
      "expected_complete": false
    },
    {
      "id": "PAS-T07",
      "description": "Substituting a save-the-world mission is not the authorized task.",
      "predicate_ids": [
        "PAS-P01"
      ],
      "quint_test": "pasSelfAppointedMissionBlocksTest",
      "proposal": {
        "objectiveMatches": false,
        "grantCurrent": true,
        "evidenceComplete": true,
        "prohibitedMeans": false,
        "dominated": false,
        "withinBudget": true,
        "objectionsRetained": true,
        "sharedGate": true,
        "deferRequested": false,
        "delayUnsafe": false
      },
      "accepted": false,
      "parent_revoked": false,
      "mission_complete": false,
      "expected_outcome": "block",
      "expected_complete": false
    },
    {
      "id": "PAS-T08",
      "description": "Claimed aggregate benefit or profit cannot justify prohibited means.",
      "predicate_ids": [
        "PAS-P06"
      ],
      "quint_test": "pasProhibitedBenefitBlocksTest",
      "proposal": {
        "objectiveMatches": true,
        "grantCurrent": true,
        "evidenceComplete": true,
        "prohibitedMeans": true,
        "dominated": false,
        "withinBudget": true,
        "objectionsRetained": true,
        "sharedGate": true,
        "deferRequested": false,
        "delayUnsafe": false
      },
      "accepted": false,
      "parent_revoked": false,
      "mission_complete": false,
      "expected_outcome": "block",
      "expected_complete": false
    },
    {
      "id": "PAS-T09",
      "description": "Incomplete facts cannot become a permitted effect.",
      "predicate_ids": [
        "PAS-P01",
        "PAS-P05"
      ],
      "quint_test": "pasMissingEvidenceReviewsTest",
      "proposal": {
        "objectiveMatches": true,
        "grantCurrent": true,
        "evidenceComplete": false,
        "prohibitedMeans": false,
        "dominated": false,
        "withinBudget": true,
        "objectionsRetained": true,
        "sharedGate": true,
        "deferRequested": false,
        "delayUnsafe": false
      },
      "accepted": false,
      "parent_revoked": false,
      "mission_complete": false,
      "expected_outcome": "review",
      "expected_complete": false
    },
    {
      "id": "PAS-T10",
      "description": "Suppressing material contrary evidence requires review.",
      "predicate_ids": [
        "PAS-P05"
      ],
      "quint_test": "pasHiddenObjectionReviewsTest",
      "proposal": {
        "objectiveMatches": true,
        "grantCurrent": true,
        "evidenceComplete": true,
        "prohibitedMeans": false,
        "dominated": false,
        "withinBudget": true,
        "objectionsRetained": false,
        "sharedGate": true,
        "deferRequested": false,
        "delayUnsafe": false
      },
      "accepted": false,
      "parent_revoked": false,
      "mission_complete": false,
      "expected_outcome": "review",
      "expected_complete": false
    },
    {
      "id": "PAS-T11",
      "description": "An internal critic cannot bypass the shared decision gate.",
      "predicate_ids": [
        "PAS-P05"
      ],
      "quint_test": "pasRoleBypassReviewsTest",
      "proposal": {
        "objectiveMatches": true,
        "grantCurrent": true,
        "evidenceComplete": true,
        "prohibitedMeans": false,
        "dominated": false,
        "withinBudget": true,
        "objectionsRetained": true,
        "sharedGate": false,
        "deferRequested": false,
        "delayUnsafe": false
      },
      "accepted": false,
      "parent_revoked": false,
      "mission_complete": false,
      "expected_outcome": "review",
      "expected_complete": false
    },
    {
      "id": "PAS-T12",
      "description": "Available authorized sufficient less intrusive alternative defeats broader proposal.",
      "predicate_ids": [
        "PAS-P02"
      ],
      "quint_test": "pasDominatedInterventionReviewsTest",
      "proposal": {
        "objectiveMatches": true,
        "grantCurrent": true,
        "evidenceComplete": true,
        "prohibitedMeans": false,
        "dominated": true,
        "withinBudget": true,
        "objectionsRetained": true,
        "sharedGate": true,
        "deferRequested": false,
        "delayUnsafe": false
      },
      "accepted": false,